{
  "serialNumber": "urn:uuid:2ff5412e-5ff9-4d93-9702-9d3b2c2a92c5",
  "$schema": "../schemas/application-manifest.schema.json",
  "bomFormat": "CycloneDX",
  "specVersion": "1.6",
  "version": 1,
  "metadata": {
    "timestamp": "2026-03-11T06:31:16Z",
    "component": {
      "bom-ref": "jaeger:9e5221cf-07ac-4aea-b65c-3efe61364d2e",
      "type": "application",
      "mime-type": "application/vnd.nc.application",
      "name": "jaeger",
      "version": "1.2.3"
    },
    "tools": {
      "components": [
        {
          "type": "application",
          "name": "am-build-cli",
          "version": "0.1.0"
        }
      ]
    }
  },
  "components": [
    {
      "bom-ref": "qubership-jaeger:b6ae6074-ebc9-41a3-abe0-13ffb61366f4",
      "type": "application",
      "mime-type": "application/vnd.nc.standalone-runnable",
      "name": "qubership-jaeger",
      "version": "1.2.3",
      "properties": [],
      "components": []
    },
    {
      "bom-ref": "qubership-jaeger:60ef6d01-3824-403e-8e80-9ada9423aad6",
      "type": "application",
      "mime-type": "application/vnd.nc.helm.chart",
      "name": "qubership-jaeger",
      "version": "1.2.3",
      "purl": "pkg:helm/charts/qubership-jaeger@1.2.3?registry_name=sandbox.example.com",
      "properties": [
        {
          "name": "isLibrary",
          "value": false
        },
        {
          "name": "qubership:helm.values.artifactMappings",
          "value": {
            "jaeger-cassandra-schema:fc1bf1f0-9b7e-46b9-81ac-719474e32185": {
              "valuesPathPrefix": "cassandraSchema"
            },
            "jaeger:510e3687-f84b-4b82-ba64-2d61b4067146": {
              "valuesPathPrefix": "jaeger"
            },
            "jaeger-readiness-probe:8720e173-b2ea-4e72-b0eb-573cdd824f7a": {
              "valuesPathPrefix": "readinessProbe"
            },
            "example-hotrod:f9a057a2-ac80-44f1-8e65-2687f6636a8e": {
              "valuesPathPrefix": "exampleHotrod"
            },
            "jaeger-integration-tests:f2d8485e-be62-401a-9b2f-f451ca538d2e": {
              "valuesPathPrefix": "integrationTests"
            },
            "jaeger-es-index-cleaner:2b9fb8bf-fd5c-42ad-bced-7731e5d6b3b9": {
              "valuesPathPrefix": "elasticsearch.indexCleaner"
            },
            "jaeger-es-rollover:8ee2ed43-3b40-4b41-9b81-8598efcf2962": {
              "valuesPathPrefix": "elasticsearch.rollover"
            },
            "envoy:7165f9d1-a659-4274-8b1f-d92da5142af6": {
              "valuesPathPrefix": "proxy"
            },
            "openjdk:790b7a29-1975-4ea1-b81a-7fefa3b3a0d1": {
              "valuesPathPrefix": "."
            },
            "spark-dependencies-image:9bc28474-c783-497b-b6ac-609a2a4d9937": {
              "valuesPathPrefix": "spark"
            },
            "qubership-deployment-status-provisioner:30c25afc-b313-4649-a486-397ffe35e591": {
              "valuesPathPrefix": "statusProvisioner"
            }
          }
        }
      ],
      "hashes": [
        {
          "alg": "SHA-256",
          "content": "c01ce70d91b920226bc4f788849a85127b3f49ea4af5db4012c2ce8def0d79e1"
        }
      ],
      "components": []
    },
    {
      "bom-ref": "jaeger-cassandra-schema:fc1bf1f0-9b7e-46b9-81ac-719474e32185",
      "type": "container",
      "mime-type": "application/vnd.docker.image",
      "name": "jaeger-cassandra-schema",
      "version": "1.72.0",
      "group": "jaegertracing",
      "purl": "pkg:docker/jaegertracing/jaeger-cassandra-schema@1.72.0?registry_name=docker.io"
    },
    {
      "bom-ref": "jaeger:510e3687-f84b-4b82-ba64-2d61b4067146",
      "type": "container",
      "mime-type": "application/vnd.docker.image",
      "name": "jaeger",
      "version": "2.9.0",
      "group": "jaegertracing",
      "purl": "pkg:docker/jaegertracing/jaeger@2.9.0?registry_name=docker.io"
    },
    {
      "bom-ref": "example-hotrod:f9a057a2-ac80-44f1-8e65-2687f6636a8e",
      "type": "container",
      "mime-type": "application/vnd.docker.image",
      "name": "example-hotrod",
      "version": "1.72.0",
      "group": "jaegertracing",
      "purl": "pkg:docker/jaegertracing/example-hotrod@1.72.0?registry_name=docker.io"
    },
    {
      "bom-ref": "jaeger-es-index-cleaner:2b9fb8bf-fd5c-42ad-bced-7731e5d6b3b9",
      "type": "container",
      "mime-type": "application/vnd.docker.image",
      "name": "jaeger-es-index-cleaner",
      "version": "1.72.0",
      "group": "jaegertracing",
      "purl": "pkg:docker/jaegertracing/jaeger-es-index-cleaner@1.72.0?registry_name=docker.io"
    },
    {
      "bom-ref": "jaeger-es-rollover:8ee2ed43-3b40-4b41-9b81-8598efcf2962",
      "type": "container",
      "mime-type": "application/vnd.docker.image",
      "name": "jaeger-es-rollover",
      "version": "1.72.0",
      "group": "jaegertracing",
      "purl": "pkg:docker/jaegertracing/jaeger-es-rollover@1.72.0?registry_name=docker.io"
    },
    {
      "bom-ref": "envoy:7165f9d1-a659-4274-8b1f-d92da5142af6",
      "type": "container",
      "mime-type": "application/vnd.docker.image",
      "name": "envoy",
      "version": "v1.32.6",
      "group": "envoyproxy",
      "purl": "pkg:docker/envoyproxy/envoy@v1.32.6?registry_name=docker.io"
    },
    {
      "bom-ref": "openjdk:790b7a29-1975-4ea1-b81a-7fefa3b3a0d1",
      "type": "container",
      "mime-type": "application/vnd.docker.image",
      "name": "openjdk",
      "version": "11",
      "group": "library",
      "purl": "pkg:docker/library/openjdk@11?registry_name=docker.io"
    },
    {
      "bom-ref": "jaeger-readiness-probe:8720e173-b2ea-4e72-b0eb-573cdd824f7a",
      "type": "container",
      "mime-type": "application/vnd.docker.image",
      "name": "jaeger-readiness-probe",
      "version": "1.2.3",
      "group": "qubership",
      "purl": "pkg:docker/qubership/jaeger-readiness-probe@1.2.3?registry_name=sandbox.example.com",
      "hashes": [
        {
          "alg": "SHA-256",
          "content": "a1a1a1a1a1a1a1a1a1a1a1a1a1a1a1a1a1a1a1a1a1a1a1a1a1a1a1a1a1a1a1a1"
        }
      ]
    },
    {
      "bom-ref": "jaeger-integration-tests:f2d8485e-be62-401a-9b2f-f451ca538d2e",
      "type": "container",
      "mime-type": "application/vnd.docker.image",
      "name": "jaeger-integration-tests",
      "version": "1.2.3",
      "group": "qubership",
      "purl": "pkg:docker/qubership/jaeger-integration-tests@1.2.3?registry_name=sandbox.example.com",
      "hashes": [
        {
          "alg": "SHA-256",
          "content": "b2b2b2b2b2b2b2b2b2b2b2b2b2b2b2b2b2b2b2b2b2b2b2b2b2b2b2b2b2b2b2b2"
        }
      ]
    },
    {
      "bom-ref": "spark-dependencies-image:9bc28474-c783-497b-b6ac-609a2a4d9937",
      "type": "container",
      "mime-type": "application/vnd.docker.image",
      "name": "spark-dependencies-image",
      "version": "1.2.3",
      "group": "qubership",
      "purl": "pkg:docker/qubership/spark-dependencies-image@1.2.3?registry_name=sandbox.example.com",
      "hashes": [
        {
          "alg": "SHA-256",
          "content": "c3c3c3c3c3c3c3c3c3c3c3c3c3c3c3c3c3c3c3c3c3c3c3c3c3c3c3c3c3c3c3c3"
        }
      ]
    },
    {
      "bom-ref": "qubership-deployment-status-provisioner:30c25afc-b313-4649-a486-397ffe35e591",
      "type": "container",
      "mime-type": "application/vnd.docker.image",
      "name": "qubership-deployment-status-provisioner",
      "version": "1.2.3",
      "group": "qubership",
      "purl": "pkg:docker/qubership/qubership-deployment-status-provisioner@1.2.3?registry_name=sandbox.example.com",
      "hashes": [
        {
          "alg": "SHA-256",
          "content": "d4d4d4d4d4d4d4d4d4d4d4d4d4d4d4d4d4d4d4d4d4d4d4d4d4d4d4d4d4d4d4d4"
        }
      ]
    }
  ],
  "dependencies": [
    {
      "ref": "jaeger:9e5221cf-07ac-4aea-b65c-3efe61364d2e",
      "dependsOn": [
        "qubership-jaeger:b6ae6074-ebc9-41a3-abe0-13ffb61366f4",
        "qubership-jaeger:60ef6d01-3824-403e-8e80-9ada9423aad6",
        "jaeger-cassandra-schema:fc1bf1f0-9b7e-46b9-81ac-719474e32185",
        "jaeger:510e3687-f84b-4b82-ba64-2d61b4067146",
        "example-hotrod:f9a057a2-ac80-44f1-8e65-2687f6636a8e",
        "jaeger-es-index-cleaner:2b9fb8bf-fd5c-42ad-bced-7731e5d6b3b9",
        "jaeger-es-rollover:8ee2ed43-3b40-4b41-9b81-8598efcf2962",
        "envoy:7165f9d1-a659-4274-8b1f-d92da5142af6",
        "openjdk:790b7a29-1975-4ea1-b81a-7fefa3b3a0d1",
        "jaeger-readiness-probe:8720e173-b2ea-4e72-b0eb-573cdd824f7a",
        "jaeger-integration-tests:f2d8485e-be62-401a-9b2f-f451ca538d2e",
        "spark-dependencies-image:9bc28474-c783-497b-b6ac-609a2a4d9937",
        "qubership-deployment-status-provisioner:30c25afc-b313-4649-a486-397ffe35e591"
      ]
    },
    {
      "ref": "qubership-jaeger:b6ae6074-ebc9-41a3-abe0-13ffb61366f4",
      "dependsOn": [
        "qubership-jaeger:60ef6d01-3824-403e-8e80-9ada9423aad6"
      ]
    },
    {
      "ref": "qubership-jaeger:60ef6d01-3824-403e-8e80-9ada9423aad6",
      "dependsOn": [
        "jaeger-cassandra-schema:fc1bf1f0-9b7e-46b9-81ac-719474e32185",
        "jaeger:510e3687-f84b-4b82-ba64-2d61b4067146",
        "jaeger-readiness-probe:8720e173-b2ea-4e72-b0eb-573cdd824f7a",
        "example-hotrod:f9a057a2-ac80-44f1-8e65-2687f6636a8e",
        "jaeger-integration-tests:f2d8485e-be62-401a-9b2f-f451ca538d2e",
        "jaeger-es-index-cleaner:2b9fb8bf-fd5c-42ad-bced-7731e5d6b3b9",
        "jaeger-es-rollover:8ee2ed43-3b40-4b41-9b81-8598efcf2962",
        "envoy:7165f9d1-a659-4274-8b1f-d92da5142af6",
        "openjdk:790b7a29-1975-4ea1-b81a-7fefa3b3a0d1",
        "spark-dependencies-image:9bc28474-c783-497b-b6ac-609a2a4d9937",
        "qubership-deployment-status-provisioner:30c25afc-b313-4649-a486-397ffe35e591"
      ]
    }
  ]
}